{
  "prototype_id": "louvre-abudhabi-p01",
  "case_id": "louvre-abudhabi",
  "case_root": "examples/new_examplex/louvre_abudhabi",
  "slide_ids": ["P01"],
  "pack_id": "dark-cinematic-tech",
  "composition_ids": ["c1-01"],
  "page_roles": ["cover"],
  "summary": "Full-bleed nocturnal architecture image with native editorial title and restrained star geometry.",
  "source_paths": ["output/louvre_abudhabi_complete.pptx"],
  "preview_paths": ["rendered/slide01.png", "output/louvre_abudhabi_complete.pdf"],
  "recipe_paths": ["prototype/recipe.md"],
  "object_map_paths": ["prototype/object-map.md"],
  "license_status": "verified",
  "context_allowed": true,
  "redaction_status": "not_required"
}
