{
  "prototype_id": "louvre-abudhabi-p07",
  "case_id": "louvre-abudhabi",
  "case_root": "examples/new_examplex/louvre_abudhabi",
  "slide_ids": ["P07"],
  "pack_id": "dark-cinematic-tech",
  "composition_ids": ["c3-01"],
  "page_roles": ["sequence"],
  "summary": "Directional triptych that presents spatial experience as a sequence rather than equal cards.",
  "source_paths": ["output/louvre_abudhabi_complete.pptx"],
  "preview_paths": ["rendered/slide07.png", "output/louvre_abudhabi_complete.pdf"],
  "recipe_paths": ["prototype/recipe.md"],
  "object_map_paths": ["prototype/object-map.md"],
  "license_status": "restricted",
  "context_allowed": false,
  "redaction_status": "not_required"
}
