{
  "prototype_id": "car-t-single-cell-p03",
  "case_id": "car-t-single-cell-paper",
  "case_root": "examples/new_examplex/car_t_single_cell_paper",
  "slide_ids": ["P03", "P06", "P11"],
  "pack_id": "scientific-atlas",
  "composition_ids": ["c2-01", "c4-01"],
  "page_roles": ["study-map", "evidence-wall", "key-finding"],
  "summary": "Evidence-first study map, multi-panel evidence wall, and evidence ladder with editable scientific boundaries.",
  "source_paths": ["output/car_t_single_cell_atlas_blue_editorial.pptx"],
  "preview_paths": ["rendered/slide03.png", "rendered/slide06.png", "rendered/slide11.png", "output/car_t_single_cell_atlas_blue_editorial.pdf"],
  "recipe_paths": ["prototype/recipe.md"],
  "object_map_paths": ["prototype/object-map.md"],
  "license_status": "verified",
  "context_allowed": true,
  "redaction_status": "not_required"
}
